{"dataset_identity":{"config_name":"evaluation-records-jsonl-v1","dataset_name":"qwen3-0.6b-base-to-post-trained","provider":"local","revision":"d80e81ba17fb93b9b8a46f9817f9841f5f9c2858c9d703b3ce28847b2eaeb57c","split":"validation"},"format_version":"invarlock/runtime-behavioral-schedule-v1","records":[{"expected_output":" Paris","input_parts":[{"kind":"text","role":"prompt","sha256":"bbaff4d2ecd5892d4a442b0f53131641bf6e6f284761dd20fc0664bc97145762","text":"The capital of France is"}],"input_sha256":"db3843133c035a201c77cff1c9911465651cc28805998feb1543795d16b3670a","record_id":"causal-cloze-000"},{"expected_output":" Rome","input_parts":[{"kind":"text","role":"prompt","sha256":"4830b324557e2e671f536a303d65507fbf860e8eea176c4a4b4b81b375053f7b","text":"The capital of Italy is"}],"input_sha256":"2b9f2dc7faaf194c161fb2393e89f73453eadbf4d700109f8b27e2fd8de2f90b","record_id":"causal-cloze-001"},{"expected_output":" Tokyo","input_parts":[{"kind":"text","role":"prompt","sha256":"729bebb2f0359fff1b03978118b4d7b01a59ce6c9c545fc4e9918d9e847066d2","text":"The capital of Japan is"}],"input_sha256":"33c61ec3a46d879864c8894d26c72660a888e3db738232024d4ee9b0bfa3ccaa","record_id":"causal-cloze-002"},{"expected_output":" Berlin","input_parts":[{"kind":"text","role":"prompt","sha256":"ef9a634f95d612b951bcb1976087e5c301793517e7e35f3c50da838c5e5efcbb","text":"The capital of Germany is"}],"input_sha256":"022d9f2381b43502908027af9aee2bf39a82036ce6d83a87c8d2b3acb804e32f","record_id":"causal-cloze-003"},{"expected_output":" Madrid","input_parts":[{"kind":"text","role":"prompt","sha256":"2369a4aa826fb7b918c4e3148acd95c9aff1b9845bae35a54be3e644611b4850","text":"The capital of Spain is"}],"input_sha256":"1c37fb3d1f56ac700323d53deb5a10d79dc81544626dfefd2ff59deecb0d0fc6","record_id":"causal-cloze-004"},{"expected_output":" east","input_parts":[{"kind":"text","role":"prompt","sha256":"4b45bb49bfde43a84b7bc641d136ac56f8f99092929a17b1b619d2a250f6c123","text":"The sun rises in the"}],"input_sha256":"572c34d2b007894d19e425caa260d1d701182e4dae60adc2256a1d7012906cc8","record_id":"causal-cloze-006"},{"expected_output":" west","input_parts":[{"kind":"text","role":"prompt","sha256":"4827c91ca8d9fb848b6a5452ab39f3f849a5d2af8cf22ea213633286f04610ad","text":"The sun sets in the"}],"input_sha256":"91c673ea5d757962668f5d9c729f8f137f600780be73d9c8cc7ddbebcd537a92","record_id":"causal-cloze-007"},{"expected_output":" blue","input_parts":[{"kind":"text","role":"prompt","sha256":"f8ff64e06731c4a9c38f94ca4c87b954929fcf8849e2f1f1b4757c13979ebc0e","text":"The sky is usually"}],"input_sha256":"e62b07d2a07e56430cb8841da3671738dbd300243effae72e764edca17691c30","record_id":"causal-cloze-008"},{"expected_output":" white","input_parts":[{"kind":"text","role":"prompt","sha256":"cb4d2e43596ed260c038676ad032115c99cfb4000e27743ff0c508acc2915ca0","text":"Fresh snow is usually"}],"input_sha256":"ce20cfe693790c3d1a8bc0316a9b6ebad108d39712245fc34a768cf01d3cb5f4","record_id":"causal-cloze-009"},{"expected_output":" green","input_parts":[{"kind":"text","role":"prompt","sha256":"dca12e0aa48fe76ec1ce4f8b453c2731d926cced4dfd7fab7eb5c2802e5a4ae0","text":"Healthy grass is usually"}],"input_sha256":"2667b588b453ecadbd2b1b589f819b392dfbf64a24508c41b282ddd844829628","record_id":"causal-cloze-010"},{"expected_output":" black","input_parts":[{"kind":"text","role":"prompt","sha256":"4d76852d2e45c4867f9f1bd61f138a5bc1c908f6a8bd9d096b91ea4ae0661469","text":"Coal is usually"}],"input_sha256":"d98bef2efce448235fb48e28e50a829b066ca9cac3db3415d7bd21a0319fc42f","record_id":"causal-cloze-011"},{"expected_output":" two","input_parts":[{"kind":"text","role":"prompt","sha256":"91492260680c4c0918a1ca639a4d5a047e0e4fad8b30586218b278441518727a","text":"One plus one equals"}],"input_sha256":"647782a3d164eb066ffa12ad14aa93889ef7f74fb601e8dff9b0f7b11e68b4fd","record_id":"causal-cloze-012"},{"expected_output":" four","input_parts":[{"kind":"text","role":"prompt","sha256":"cdf1347c153639e3f67e4cdabf1c6e1acf41f33bb067ed6f4e82b4d518a91a65","text":"Two plus two equals"}],"input_sha256":"44391ec3b09168ce9d97ecf536d2e2c9e366a1965c304afd29bd4cb3b355f2b2","record_id":"causal-cloze-013"},{"expected_output":" six","input_parts":[{"kind":"text","role":"prompt","sha256":"bcf2a27e786c0705b2ec87cf081c03d38e2013f54d30952c8c6b09cac4e93d5b","text":"Three plus three equals"}],"input_sha256":"6606b318ff1799f76af474f82aa3ba92e19df1cef7ba172d5a9a1e58169407cf","record_id":"causal-cloze-014"},{"expected_output":" ten","input_parts":[{"kind":"text","role":"prompt","sha256":"36d8ab6860e97b75e958d198002634137131db725c76a8db0846607d8875af4a","text":"Five plus five equals"}],"input_sha256":"1f1259c665b99e9eca2bb905654b27e4f4c517282b2d7c328825017f8a2e3f11","record_id":"causal-cloze-015"},{"expected_output":" sides","input_parts":[{"kind":"text","role":"prompt","sha256":"b436a94e64d561593ce8beaf6addc29ef968aa2af14bf2ee189359eab669f2a6","text":"A triangle has three"}],"input_sha256":"31833195fff72082c07049ff505a6749f7263c10671f0f71f969be5ff987863e","record_id":"causal-cloze-016"},{"expected_output":" sides","input_parts":[{"kind":"text","role":"prompt","sha256":"e776c465254d4702f9ef262a9bdf752e34a97e5b8ebf7c1ec514a1ad3caee216","text":"A square has four"}],"input_sha256":"a1b2a1171ac99ed48f04d18015b2aa0a6313421753242f11ec8f628394aa339d","record_id":"causal-cloze-017"},{"expected_output":" days","input_parts":[{"kind":"text","role":"prompt","sha256":"95ab54d56b89d17bf7560469c8bb05aec22fc379bb29fe17bd59caa1e673e7d3","text":"A week has seven"}],"input_sha256":"51173a86c13155cee5b670a6362324e3b17fb25935fadfe1c5dcaa2c1ffb80be","record_id":"causal-cloze-018"},{"expected_output":" months","input_parts":[{"kind":"text","role":"prompt","sha256":"71deb0f5f2dd0761ad184356a2d8b3a48ff8105963c9ceec42812bf0210d3bbc","text":"A year has twelve"}],"input_sha256":"a063bfc74400c43c1661a54b2b7fa3b9b0c5500e8186f9c15c4a091639a1fab9","record_id":"causal-cloze-019"},{"expected_output":" hours","input_parts":[{"kind":"text","role":"prompt","sha256":"83920a4a93254781da62658a1007544b9ebd2a0f467bf52c72575d3b55d6346d","text":"A day has twenty-four"}],"input_sha256":"66d2852a7cbdde0d6d76e4f5992be5fab55143d8dd9fa3ffaf2ed8ef7a3d9af2","record_id":"causal-cloze-020"},{"expected_output":" minutes","input_parts":[{"kind":"text","role":"prompt","sha256":"eb7034106acfb61268c52734c7c4f5db6c23aa5c726f2671c7264e7aa9c47588","text":"An hour has sixty"}],"input_sha256":"30396d15e8b17cb7471fae487038c6be76c1e865f3bae6c7aabf22d807bace55","record_id":"causal-cloze-021"},{"expected_output":" seconds","input_parts":[{"kind":"text","role":"prompt","sha256":"01609d11878402078d883bdaf238afbc8bfcdfd1dca8c4437552bab4eb108286","text":"A minute has sixty"}],"input_sha256":"f0a70d614e43ee5ee42e484d7c46bf4d5a1263941ddb298b7c293bcb092bfd08","record_id":"causal-cloze-022"},{"expected_output":" cold","input_parts":[{"kind":"text","role":"prompt","sha256":"499d3b29e245003b63f6e79d2fa436b28583acfd82237825c9b856d21ff85143","text":"The opposite of hot is"}],"input_sha256":"84de155eded2a8a9566eff924cb07b88acaf491fe9e7881b0c7a2df709e595a7","record_id":"causal-cloze-023"},{"expected_output":" down","input_parts":[{"kind":"text","role":"prompt","sha256":"ae499207651a70828ed330ad90464b0e9cc35d78c50d21a31a425b922a7ae4de","text":"The opposite of up is"}],"input_sha256":"4d526f50b5e7c5a7846a5daca1a713699c036199046441699f657564dc2f29f3","record_id":"causal-cloze-024"},{"expected_output":" right","input_parts":[{"kind":"text","role":"prompt","sha256":"43ad7b790d3db7e5c1bda1fce84c4b26338bc9459d566e2dd46e966ca4e242ad","text":"The opposite of left is"}],"input_sha256":"084f686860c15395c4795b0ff49481d953686c45ec3825bdcd4e25aef7b07498","record_id":"causal-cloze-025"},{"expected_output":" night","input_parts":[{"kind":"text","role":"prompt","sha256":"407f659eb8b4caa5b2528710ea4cfc5e8015d98d231553c5a31a006fc7a891b0","text":"The opposite of day is"}],"input_sha256":"7394b21193d655067960d8bdc7722b7373a96070c30b878945f5b99b4e3be4e1","record_id":"causal-cloze-026"},{"expected_output":" new","input_parts":[{"kind":"text","role":"prompt","sha256":"d9aaa9effd26382c249c3f17c8174f797706b45209703f4f309206a8f5a728e6","text":"The opposite of old is"}],"input_sha256":"a5ac804a89608e0ec53b5cbe064ff4ba6a59fd263f7fee2c29a0722c3c53142b","record_id":"causal-cloze-027"},{"expected_output":" slow","input_parts":[{"kind":"text","role":"prompt","sha256":"b227bea3fcfeecd2b845bb1c85f4b349377e536b13a91f9c5201e0071d995d00","text":"The opposite of fast is"}],"input_sha256":"b6f9676f5cab1bea772a4e148964ea64654c9cbdc87f4a357543adee9e7bd8ea","record_id":"causal-cloze-028"},{"expected_output":" water","input_parts":[{"kind":"text","role":"prompt","sha256":"60f78f57e166e8fc7844e25cea26a1b7e64cedcae9a5332aa27daf15b2d763fa","text":"Fish live in"}],"input_sha256":"ae85b649267e4015669bd9c3d6ad6ac43cc0c55551a3da424e2bb8de01367bfd","record_id":"causal-cloze-029"},{"expected_output":" fly","input_parts":[{"kind":"text","role":"prompt","sha256":"2875930744e59fd68cb6e2d89f5887a37df32e6bf36101d624e2e46932b8c4c3","text":"Birds can"}],"input_sha256":"a4b3a3accbfd779ab0e3f0a10929d60ec103ae4af142f730ea33d66fd169cdf0","record_id":"causal-cloze-030"},{"expected_output":" air","input_parts":[{"kind":"text","role":"prompt","sha256":"ef7523efe185a9b74f3c16161da6d177b1ad1dce093b0db8d49411b0d7da0e42","text":"People breathe"}],"input_sha256":"622321d2658a1a8bfb7690f21323c18868061c19f62a6f01b073c0687abb47e5","record_id":"causal-cloze-031"},{"expected_output":" milk","input_parts":[{"kind":"text","role":"prompt","sha256":"cd30c53f639602504cbe0f68dfe86bf19906872eda6eb99a12adb2ec0bf1bcf6","text":"Cows produce"}],"input_sha256":"78a00697adab06025f1688c3f0ba4dbe58a1c6a8e6775351e23746822ca562a7","record_id":"causal-cloze-033"},{"expected_output":" mat","input_parts":[{"kind":"text","role":"prompt","sha256":"fd5793ca02d8424f7a135d0dafb7ba5e5ab73505810eecbfbea89e8814cec637","text":"The cat sat on the"}],"input_sha256":"081e2f596dd7910bc52e218e9cb4cf2ee1a2a23bbd6d53911498169c2a00b2